{
  "version": "6.0",
  "description": "Clean simple apartment v6.0 - 9m x 7m, 4 rooms (living/kitchen/bedroom/bathroom), open-plan kitchen, single consistent layout for nav + UE",
  "source": "redesign: shrank 65-obstacle clutter to 18 clean obstacles; split into living/kitchen/bedroom/bathroom with door gaps; spawn in open living room",
  "grid": {
    "width": 160,
    "height": 120,
    "resolution": 0.1,
    "origin_x": -8.0,
    "origin_y": -6.0,
    "comment": "16m x 12m grid, 0.1m/cell (room occupies x[-4.5,4.5] y[-3.5,3.5])"
  },
  "sim": {
    "fps": 30,
    "dt": 0.033333,
    "visual_max_speed": 2.0,
    "visual_max_step": 0.066667,
    "arrival_radius": 0.45,
    "soft_skip_radius": 1.0,
    "soft_skip_frames": 500,
    "hard_skip_frames": 1000,
    "dynamic_clearance": 1.0,
    "dyn_collision_radius": 0.45
  },
  "robot": {
    "radius_planning": 0.3,
    "radius_cbf": 0.25,
    "cbf_d_safe": 0.3,
    "cbf_d_critical": 0.08,
    "cbf_alpha": 2.0,
    "cbf_max_speed": 1.5,
    "initial_pose": {
      "x": 0.5,
      "y": -2.2,
      "yaw": 0.0
    }
  },
  "lidar": {
    "n_rays": 72,
    "max_range": 12.0,
    "angle_min": -3.14159,
    "angle_max": 3.14159,
    "comment": "72 rays = 5 degree spacing, full 360 degrees, 12m range"
  },
  "amcl": {
    "n_particles": 300,
    "sigma_obs": 0.45,
    "z_max": 12.0,
    "n_obs_rays": 72,
    "kld_min": 50,
    "kld_max": 500,
    "kidnap_recover_spread": 3.0
  },
  "obstacles": [
    {
      "name": "wall_south",
      "xmin": -4.5,
      "ymin": -3.5,
      "xmax": 4.5,
      "ymax": -3.3
    },
    {
      "name": "wall_north",
      "xmin": -4.5,
      "ymin": 3.3,
      "xmax": 4.5,
      "ymax": 3.5
    },
    {
      "name": "wall_west",
      "xmin": -4.5,
      "ymin": -3.5,
      "xmax": -4.3,
      "ymax": 3.5
    },
    {
      "name": "wall_east",
      "xmin": 4.3,
      "ymin": -3.5,
      "xmax": 4.5,
      "ymax": 3.5
    },
    {
      "name": "wall_h_bed_l",
      "xmin": -4.3,
      "ymin": 0.8,
      "xmax": -1.2,
      "ymax": 1.0
    },
    {
      "name": "wall_h_mid",
      "xmin": 0.3,
      "ymin": 0.8,
      "xmax": 1.5,
      "ymax": 1.0
    },
    {
      "name": "wall_h_bath_r",
      "xmin": 3.2,
      "ymin": 0.8,
      "xmax": 4.3,
      "ymax": 1.0
    },
    {
      "name": "wall_v_bed_bath",
      "xmin": 0.4,
      "ymin": 1.0,
      "xmax": 0.6,
      "ymax": 3.3
    },
    {
      "name": "sofa",
      "xmin": -3.8,
      "ymin": -3.3,
      "xmax": -1.8,
      "ymax": -2.6
    },
    {
      "name": "coffee_table",
      "xmin": -1.4,
      "ymin": -2.2,
      "xmax": -0.4,
      "ymax": -1.5
    },
    {
      "name": "tv_console",
      "xmin": -3.8,
      "ymin": 0.4,
      "xmax": -2.8,
      "ymax": 0.8
    },
    {
      "name": "counter",
      "xmin": 3.6,
      "ymin": -3.3,
      "xmax": 4.3,
      "ymax": 0.8
    },
    {
      "name": "dining_table",
      "xmin": 1.5,
      "ymin": -2.8,
      "xmax": 3.0,
      "ymax": -2.0
    },
    {
      "name": "bed",
      "xmin": -4.0,
      "ymin": 1.4,
      "xmax": -2.2,
      "ymax": 3.0
    },
    {
      "name": "wardrobe",
      "xmin": -2.1,
      "ymin": 2.2,
      "xmax": -0.8,
      "ymax": 3.1
    },
    {
      "name": "toilet",
      "xmin": 0.9,
      "ymin": 1.3,
      "xmax": 1.5,
      "ymax": 2.0
    },
    {
      "name": "bathtub",
      "xmin": 2.8,
      "ymin": 1.4,
      "xmax": 4.0,
      "ymax": 3.0
    },
    {
      "name": "sink",
      "xmin": 1.6,
      "ymin": 2.9,
      "xmax": 2.4,
      "ymax": 3.3
    }
  ],
  "patrol_targets": [
    {
      "name": "dock",
      "x": 0.5,
      "y": -2.2,
      "yaw": 0.0
    },
    {
      "name": "living_room",
      "x": -2.5,
      "y": -1.5,
      "yaw": 0.0
    },
    {
      "name": "kitchen",
      "x": 2.5,
      "y": -1.0,
      "yaw": 1.5708
    },
    {
      "name": "bedroom",
      "x": -1.4,
      "y": 1.6,
      "yaw": 3.14159
    },
    {
      "name": "bathroom",
      "x": 2.0,
      "y": 2.4,
      "yaw": 3.14159
    }
  ],
  "pedestrians": [
    {
      "name": "person_1",
      "x": 0.0,
      "y": -1.5,
      "vx": -0.01,
      "vy": 0.006,
      "radius": 0.3
    },
    {
      "name": "person_2",
      "x": 3.0,
      "y": -1.5,
      "vx": 0.008,
      "vy": -0.006,
      "radius": 0.3
    },
    {
      "name": "person_3",
      "x": -2.5,
      "y": 2.0,
      "vx": 0.008,
      "vy": -0.008,
      "radius": 0.3
    }
  ],
  "rooms": [
    {
      "name": "living_room",
      "test": "y < 0.8 and x < 0.9 and y > -3.3"
    },
    {
      "name": "kitchen",
      "test": "x > 0.9 and y < 0.8"
    },
    {
      "name": "bedroom",
      "test": "x < -0.6 and y > 1.0"
    },
    {
      "name": "bathroom",
      "test": "x > 0.6 and y > 1.0"
    },
    {
      "name": "hallway",
      "test": "else"
    }
  ],
  "path_follower": {
    "lookahead": 0.6,
    "search_window": 20,
    "arrival_threshold": 0.45
  }
}